
"Disposable, Pizza Box LOGO 12in",1,Disposable,false,true,each,07/20/2026 00:00:00,0.16,I Halper Paper and Supplies Inc,IT - 530 Seventh Ave
"Produce, Fancy Orange",4,Produce,true,true,each,07/20/2026 00:00:00,0.61,Driscoll Foods,IT - 530 Seventh Ave
"Disposables, SUPP Napkin",6,Disposable,false,true,pack,07/20/2026 00:00:00,0.01,I Halper Paper and Supplies Inc,IT - 530 Seventh Ave
"Disposable, Clear Dome Lid 24-32",1,Disposable,false,true,each,07/20/2026 00:00:00,0.51,I Halper Paper and Supplies Inc,IT - 530 Seventh Ave
"Cleaning Supplies, SUPP Black Gloves M Size",4,Disposable,false,true,pack,07/20/2026 00:00:00,0.05,I Halper Paper and Supplies Inc,IT - 530 Seventh Ave
"Produce, Mozzarella Vegan",1,Dairy,false,false,each,07/20/2026 00:00:00,4.9,VIANDER INC,IT - 1656 Collins Ave
"Produce, Lettuce Romaine",11,Produce,true,true,each,07/20/2026 00:00:00,1.33,Driscoll Foods,IT - 530 Seventh Ave
"Disposables, SUPP Take-Out Boxes",5,Disposable,false,true,pack,07/20/2026 00:00:00,0.2,I Halper Paper and Supplies Inc,IT - 530 Seventh Ave
"Produce, Celery",7,Produce,true,true,each,07/20/2026 00:00:00,3.19,Driscoll Foods,IT - 530 Seventh Ave
"Produce, Yellow Pepper",3,Produce,true,true,lb,07/20/2026 00:00:00,3.73,Driscoll Foods,IT - 530 Seventh Ave
"Disposable, 1.5 oz Souffle Portion Cup",5,Disposable,false,true,pack,07/20/2026 00:00:00,0.01,I Halper Paper and Supplies Inc,IT - 530 Seventh Ave
"Cleaning Supplies, VB Kit Cuttery MED-WT 4PC",1,Disposable,false,true,each,07/20/2026 00:00:00,0.22,I Halper Paper and Supplies Inc,IT - 530 Seventh Ave
"Produce, Orange",5,Produce,true,true,each,07/20/2026 00:00:00,0.55,TROPICAL FAIR PRICE CORP.,IT - 1656 Collins Ave
"NA Bev, Still Mineral Water",4,Water,true,true,each,07/20/2026 00:00:00,0.42,VIANDER INC,IT - 1656 Collins Ave
"Dry Goods, Crushed Tomato",3,Dry Goods,false,true,lb,07/20/2026 00:00:00,1,VIANDER INC,IT - 1656 Collins Ave
"Liqueur, TripleSec",0,,false,true,each,,0,,
"Baked Goods, Bindi Cookie Fragola",0,,false,false,each,,0,,
"Disposables, SUPP Small Brown Paper Kraft",0,,false,false,pack,,0,,
"Disposable, Low Temp 10% Dish Machine",0,,false,false,liter,,0,,
"Cleaning Supplies, VB Food Sanitizer",0,,false,false,each,,0,,
"Dry Goods, Fine Salt Sea",0,,false,false,each,,0,,
"Dry Goods, PARSLEY 5 LBS BULK BAG",0,,true,false,each,,0,,
"Baked Goods, Large Westin Multigrain Thick",0,,false,false,each,,0,,
"Dry Goods, Black Pepper Butcher",0,,false,false,each,,0,,
"Produce, Raspberry Jam",0,,false,true,each,,0,,
"Produce, Raspberry Fresh",0,,false,false,lb,,0,,
"Produce, Kiwi DUPE",0,,true,true,lb,,0,,
"Disposable, Clear Dome Lid 24-32oz",0,,false,false,each,,0,,
32 OZ. HEAVY PLASTIC DELI COMBOS (240)-26310,0,,false,false,each,,0,,
"Cleaning Supplies, VB Gloves Nitrile LG BLK GP",0,,false,false,each,,0,,
Salad Bowl,0,,false,false,each,,0,,
"Protein, Bresaola Bernina",0,,false,false,lb,,0,,
"Disposable,  Wood Coffee Stirrer",0,,false,false,pack,,0,,
"NA BEV, Coffee Pods Tostini",0,,false,false,each,,0,,
"Disposable, Cup cold 9oz",0,,false,false,lb,,0,,
"Disposable, White Dinner Napkin Case",0,,false,false,each,,0,,
"Disposable, Small Plastic Cup 2oz",0,,false,false,each,,0,,
"Disposable, Stirrer Wooden 5-1/2in Flat",0,,false,false,each,,0,,
"Cleaning Supplies, Multi Temp Dish Detergent",0,,false,false,each,,0,,
"Cleaning Supplies, Rinse Aid",0,,false,false,liter,,0,,
"Dry Goods, Graham Cracker Crumbs Keebler",0,,false,false,lb,,0,,
"Dry Goods, Rader Vanilla Extract",0,,false,false,lb,,0,,
"Dairy, Danish Blue",0,,false,false,each,,0,,
"Dry Goods, Syrup Vanilla Monin",0,,false,false,liter,,0,,
"Vodka, Three Olives",0,,false,true,each,,0,,
"NA Bev, Orange Juice",0,,true,false,liter,,0,,
"NA Bev, Apple Juice",0,,true,false,liter,,0,,
"Dry Goods, Chili Flakes",0,,true,false,lb,,0,,
"Protein, Pancetta",0,,true,false,lb,,0,,
"Dry Goods, Cooking Red Wine",0,,true,false,liter,,0,,
"Produce, Spicy Chili Peppers",0,,true,false,lb,,0,,
"NA Bev, Lime Juice",0,,true,false,liter,,0,,
"Dry Goods, Bindi Custard Cream",0,,true,false,lb,,0,,
"Dry Goods, Cacao Powder",0,,true,false,lb,,0,,
"Dry Goods, Coffee Ground",0,,true,false,lb,,0,,
"NA Bev, Tap Water",0,,true,false,liter,,0,,
"Dry Goods, Pistachio Tritato",0,,false,false,lb,,0,,
"Cleaning Supplies, VB Sponge Scrubbing MED Duty",0,,false,false,each,,0,,
"Dry Goods, Sweet Blend Honey",0,,false,false,lb,,0,,
"Clean Supplies, Dish Machine 10%",0,,false,false,each,,0,,
"Wine White, Sparkling Wine",0,,false,false,each,,0,,
"Dry Goods, Pistachio Paste",0,,false,false,lb,,0,,
"Dry Goods, Olea Oil",0,,false,true,liter,,0,,
"NA Bev, Italian Soda",0,,false,false,each,,0,,
"Rum, Golden Barcelo",0,,false,false,each,,0,,
"Rum, Golden Bacardi",0,,false,false,each,,0,,
"Dry Goods, Genovese Pesto",0,,true,false,lb,,0,,
"Liqueur, Fernet Branca",0,,false,false,each,,0,,
"Dry Goods, Rasberry Jam Seedless",0,,false,false,each,,0,,
"Baked Goods, Facitura Di Lampone",0,,false,false,lb,,0,,
"Wine Red, La Vis Cabernet Sauvignon Trentino",0,,true,false,each,,0,,
"Liqueur, Lomoncello 60",0,,false,false,liter,,0,,
"Whiskey, Bourbon",0,,false,false,each,,0,,
"Whiskey, DELETE NO BRAND NAME",0,,false,false,each,,0,,
"Cleaning Supplies,  Sponge Yellow/Green",0,,false,false,each,,0,,
"Wine Red, Casa Mirafiora Nebbiolo",0,,false,false,each,,0,,
"Wine White, Chardonnay La Vis Trentino",0,,false,false,each,,0,,
"Wine Red, Nero D'Avola Lamura",0,,false,false,each,,0,,
"Wine White, Prosecco Brut La Gioiosa",0,,false,false,each,,0,,
"Wine Rose, Sparkling Rose",0,,false,true,each,,0,,
"Wine Red, Villa Sparina Barbera Del Mon Ferrato",0,,true,false,each,,0,,
"Wine Red, Villa Sparina Gavi",0,,false,false,each,,0,,
"Dry Goods, Ghiraradelli Hot Cocoa Packet",0,,false,false,each,,0,,
"Produce, Zucchini",0,,false,false,each,,0,,
"Cleaning Supplies, VB Solid Silveroak",0,,false,false,each,,0,,
"Disposable, VB Box Fold Top TAKE-OUT 45 OZ",0,,false,false,lb,,0,,
"Cleaning Supplies, VB Dinner Napkin 15X17 2PLY",0,,false,false,each,,0,,
"Disposable, Sandwich Bag Nutural 6X2X9",0,,false,false,each,,0,,
"Cleaning Supplies, VB Food Service Sanitizer",0,,false,false,each,,0,,
"Dry Goods, Kleenex Cleanser Soap Foam 1L",0,,false,false,liter,,0,,
"Disposable, Freshener 3000 Metered Air",0,,false,false,each,,0,,
"NA Bev, Coca Cola",0,,false,false,each,,0,,
"Disposable, Pan Liner 25LB",0,,false,false,each,,0,,
"Cleaning Supplies, SUPP 2/CT #32 Oxyorange Multi-Surface Cleaner",0,,false,false,each,,0,,
"Disposables, Paper It Logo Large Bag",0,,false,false,each,,0,,
"Protein, SeafoodTuna Steak",0,,false,false,each,,0,,
lincoln test,0,,false,false,lb,,0,,
test,0,,false,false,lb,,0,,
"Disposable, Paper Soup Container 12oz",0,,false,false,each,,0,,
"Dry Goods, Semola Rimacinata",0,,false,true,each,,0,,
"Baked Goods, Bindi Cookies Choc Bacio Di Dama",0,,false,true,each,,0,,
"Produce, Pineapple Pint",0,,false,false,lb,,0,,
"Soda, San Pellegrino Can",0,,false,false,liter,,0,,
"Beer, Draft Lagunitas 1",0,,false,false,liter,,0,,
"Dry Goods, Syrup Caramel Monin",0,,false,false,liter,,0,,
"Rum, Captain Morgan",0,,true,false,liter,,0,,
"NA Bev, Tea Box 6-Unit",0,,false,false,each,,0,,
"NA Bev, The Pesca",0,,true,false,each,,0,,
"Protein, Mortadella Pistachio Perrarini",0,,false,false,lb,,0,,
"Protein, Mortadella Pistachio Martelli",0,,false,false,lb,,0,,
"Dry Goods, Pistachio Nut",0,,true,true,lb,,0,,
"Disposable, Coffee Lid for 12oz Hot Cup",0,,false,false,lb,,0,,
"Produce, Romaine Hearts",0,,false,true,each,,0,,
"Produce, Red Cabbage DUPE",0,,true,true,each,,0,,
"Dry Goods, Tomato Paste Isabella",0,,false,false,lb,,0,,
"Produce, Arugula",0,,true,false,each,,0,,
"Produce, Lettuce Baby Arugula",0,,true,true,lb,,0,,
"Produce, Eggplant by LB",0,,false,false,lb,,0,,
"Produce, Cherry Tomato Pint",0,,false,true,lb,,0,,
supplies,0,,false,false,lb,,0,,
"Dairy, Elfroy custard bulk",0,,false,false,each,,0,,
"Dry Goods, Test Item",0,,false,false,liter,,0,,
