
Tenant: Italian Trattoria,,Product Summary Report
,,Report as of 07/22/2026

"Product name","Item count","Category","Available in Recipe","Available in Inventory","Product unit","Last purchased","Cost","Last purchased vendor","Last purchased location"
"Disposables, Round Platter CM 31",1,PURCHASE SUMMARY,false,false,each,04/08/2025 00:00:00,5.5,ConEdison,IT - 1014 Lincoln Rd
"Gen Expenses, Uniforms",2,General expenses,false,false,each,08/15/2025 00:00:00,15.58,MODELINE TEKSTILSAN. IHR.LTD STI,IT - 390 Fifth Ave
"Produce, Quinoa",1,Food - other,false,true,lb,09/09/2025 00:00:00,3.53,ACE ENDICO,IT - 390 Fifth Ave
"White Wine, CANTINA COLLI EUGANEI MOSCATO 2023",1,Wine,false,true,each,09/10/2025 00:00:00,9,Dark Star Wine LLC,IT - 1656 Collins Ave
"White Wine, Cantina Colli Euganei Moscato 2021",1,Wine,false,true,each,09/10/2025 00:00:00,9,Dark Star Imports,IT - 1656 Collins Ave
"Dry Goods, Sundried Tomatoes in Olive Oil",1,Dry Goods,false,false,liter,09/13/2025 00:00:00,12.67,SOGNO TOSCANO,IT - 530 Seventh Ave
"Produce, Cello Radish",1,Food - other,true,true,lb,09/13/2025 00:00:00,1.85,ACE ENDICO,IT - 1656 Collins Ave
"Dry Goods, Moteoola Sugar Free",1,Food - other,false,false,each,09/13/2025 00:00:00,1.12,ACE ENDICO,IT - 1656 Collins Ave
"Protein, Prosciutto Di Parma",1,Meat/ Protein,false,true,lb,09/15/2025 00:00:00,8.8,VIANDER INC,IT - 390 Fifth Ave
"Dry Goods, Molecola",1,Food - other,true,false,each,09/20/2025 00:00:00,1.12,ACE ENDICO,IT - 1656 Collins Ave
"Dry Goods, Tomato Sauce",1,Food - other,true,false,lb,09/20/2025 00:00:00,2.48,ACE ENDICO,IT - 1656 Collins Ave
"Protein, Rovagnati Prosciutto",2,Food - other,false,true,lb,09/20/2025 00:00:00,7.28,ACE ENDICO,IT - 1656 Collins Ave
"NA Bev, Iced Lemon Tea",1,Food - other,false,true,each,09/20/2025 00:00:00,0.81,ACE ENDICO,IT - 1656 Collins Ave
"NA Bev, Lemonade",1,Food - other,false,false,each,09/20/2025 00:00:00,0.93,ACE ENDICO,IT - 1656 Collins Ave
"Dry Goods, Pistachio Halves",1,Dry Goods,false,false,lb,10/06/2025 00:00:00,4.67,VIANDER INC,IT - 1014 Lincoln Rd
"Protein, Citterio Hot Spianata Soppressata",1,Meat/ Protein,false,false,lb,11/17/2025 00:00:00,8.7,VIANDER INC,IT - 1656 Collins Ave
"Baked Goods, Plain Beignet",1,Baked Goods,false,true,each,11/18/2025 00:00:00,1.5,La Provence Miami - BILLPAY,IT - 1656 Collins Ave
"NA Bev, Tonic Mixer",1,Liquor,false,false,liter,11/20/2025 00:00:00,26.88,Southern Glazer,IT - 1014 Lincoln Rd
"Baked Goods, Walnut Muffin",1,Baked Goods,false,true,each,11/26/2025 00:00:00,1.5,La Provence Miami - BILLPAY,IT - 1656 Collins Ave
"Produce, Acai Berry Pack",1,Frozen,false,true,each,11/26/2025 00:00:00,1.25,PRO EX INTERNATIONAL,IT - 1014 Lincoln Rd
"Baked Goods, Dulce De Leche Muffin",1,Baked Goods,false,true,each,11/27/2025 00:00:00,1.5,La Provence Miami - BILLPAY,IT - 1656 Collins Ave
"Protein, Yellowfin Tuna Steak",2,Food - other,false,true,lb,11/29/2025 00:00:00,6.62,ACE ENDICO,IT - 390 Fifth Ave
"Dairy, Half and Half Creamer",1,Food - other,false,true,liter,11/29/2025 00:00:00,51.51,ACE ENDICO,IT - 390 Fifth Ave
"Dry Goods, Choco Chips",1,Food - other,true,false,lb,11/29/2025 00:00:00,5.73,ACE ENDICO,IT - 390 Fifth Ave
"Liqueur, Angostura Bitter",1,Liquor,false,false,liter,12/01/2025 00:00:00,116.95,Fifth Ave House Vendor,IT - 390 Fifth Ave
"Dry Goods, Savoia Americano",1,Liquor,false,false,liter,12/01/2025 00:00:00,43.98,Fifth Ave House Vendor,IT - 390 Fifth Ave
"Tequila, Maestro Dobel Diamante Blanco",1,Liquor,false,false,liter,12/01/2025 00:00:00,66.65,Fifth Ave House Vendor,IT - 390 Fifth Ave
"Tequila, Gran Centenario Blanco",1,Liquor,false,false,liter,12/01/2025 00:00:00,29.19,Fifth Ave House Vendor,IT - 390 Fifth Ave
"Liquor, Rum Diplomatico",1,Liquor,false,false,liter,12/01/2025 00:00:00,53.32,Fifth Ave House Vendor,IT - 390 Fifth Ave
"Whiskey, Tincup",1,Liquor,false,false,liter,12/01/2025 00:00:00,47.99,Fifth Ave House Vendor,IT - 390 Fifth Ave
"Liqueur, Curacao",1,Liquor,false,false,each,12/01/2025 00:00:00,11.55,Fifth Ave House Vendor,IT - 390 Fifth Ave
"Whiskey, DELETE NO BRAND NAME Black Label",1,Liquor,false,false,liter,12/01/2025 00:00:00,52.7,Fifth Ave House Vendor,IT - 390 Fifth Ave
"Tequila, Mezcal 400 Conejos",1,Liquor,false,false,liter,12/01/2025 00:00:00,43.99,Fifth Ave House Vendor,IT - 390 Fifth Ave
"Vodka, Crown Russe",1,Liquor,false,false,liter,12/01/2025 00:00:00,5.49,Fifth Ave House Vendor,IT - 390 Fifth Ave
"Vodka, New Amsterdam",1,Liquor,false,false,liter,12/01/2025 00:00:00,17.33,Fifth Ave House Vendor,IT - 390 Fifth Ave
"Whiskey, Jack Daniel's",1,Liquor,false,false,liter,12/01/2025 00:00:00,26.67,Fifth Ave House Vendor,IT - 390 Fifth Ave
"Tequila, Golden Jose Cuervo",1,Liquor,false,false,liter,12/01/2025 00:00:00,70.89,Fifth Ave House Vendor,IT - 390 Fifth Ave
"Liqueur, Montenegro Amaro",1,Liquor,false,false,liter,12/02/2025 00:00:00,47.99,Fifth Ave House Vendor,IT - 390 Fifth Ave
"Wine Red, Tenuta L'impostino Ottava Rima 2021",3,Wine,true,true,each,12/02/2025 00:00:00,20,Fifth Ave House Vendor,IT - 390 Fifth Ave
"Baked Goods, Baci Di Dama",1,Baked Goods,false,true,each,12/02/2025 00:00:00,0.34,Fifth Ave House Vendor,IT - 390 Fifth Ave
"Liqueur, Martini & Rosso Bianco",1,Liquor,false,false,liter,12/02/2025 00:00:00,13,Fifth Ave House Vendor,IT - 390 Fifth Ave
"Red Wine, FEUDI D’ALBE BOVE MONTEPULCIANO D’ABRUZZO 2020",2,Wine,true,true,each,12/02/2025 00:00:00,13,Fifth Ave House Vendor,IT - 390 Fifth Ave
"Liqueur, Sambuca Molinari",1,Liquor,false,false,liter,12/02/2025 00:00:00,46.65,Fifth Ave House Vendor,IT - 390 Fifth Ave
"Baked Goods, Cheese Danish",1,Baked Goods,false,false,each,12/04/2025 00:00:00,1.5,La Provence Miami - BILLPAY,IT - 1656 Collins Ave
"Dairy, Cheese Danish Blue Wheel",1,Dairy,false,false,lb,12/04/2025 00:00:00,0.8,Driscoll Foods,IT - 390 Fifth Ave
"Baked Goods, Croissant Roll",1,Food - other,true,true,each,12/04/2025 00:00:00,1.34,ACE ENDICO,IT - 390 Fifth Ave
"Dairy, Cherry Greek Yogurt",1,Food - other,false,true,lb,12/04/2025 00:00:00,4.6,ACE ENDICO,IT - 390 Fifth Ave
"Wine Red, La Vis Cabernet Trentino 2023",2,Wine,false,true,each,12/05/2025 00:00:00,12,Southern Glazer,IT - 1014 Lincoln Rd
"Dry Goods, Tahini Paste",2,Food - other,true,true,lb,12/06/2025 00:00:00,6.86,ACE ENDICO,IT - 390 Fifth Ave
"Baked Goods, Schiacciata Toscana",1,Dry Goods,false,true,lb,12/10/2025 00:00:00,6.8,SOGNO TOSCANO,IT - 390 Fifth Ave
"Baked Goods, Sorriso Pinsa",1,Dry Goods,false,true,each,12/10/2025 00:00:00,3.67,SOGNO TOSCANO,IT - 390 Fifth Ave
"Produce, Jumbo Red Onion",1,Produce,true,false,lb,12/15/2025 00:00:00,0.75,PRO EX INTERNATIONAL,IT - 1656 Collins Ave
"Produce, Kiwi Clamshells",1,Produce,false,false,lb,12/15/2025 00:00:00,3.41,PRO EX INTERNATIONAL,IT - 1656 Collins Ave
"Liqueur, Nikka Single Malt Yoichi",1,Liquor,false,false,liter,12/19/2025 00:00:00,172.8,Southern Glazer,IT - 1656 Collins Ave
"Baked Goods, Fiasconaro Panettone Cioccolato",1,Baked Goods,false,false,lb,12/19/2025 00:00:00,14.29,VIANDER INC,IT - 1656 Collins Ave
"Liquor, Gin Hendricks 1L",1,Liquor,false,false,liter,12/23/2025 00:00:00,499,Fifth Ave House Vendor,IT - 390 Fifth Ave
"Gin, Canaima",1,Liquor,false,false,liter,12/23/2025 00:00:00,29.99,Fifth Ave House Vendor,IT - 390 Fifth Ave
"Protein, Hot Calabrese",1,Food - other,false,true,lb,12/27/2025 00:00:00,1.12,ACE ENDICO,IT - 390 Fifth Ave
"Baked Goods, Multigrain Demi Baguette",1,Baked Goods,false,true,each,12/30/2025 00:00:00,1.05,La Provence Miami - BILLPAY,IT - 1656 Collins Ave
"Dry Goods, Cherry Tomato Semi Dried",1,Food - other,false,true,lb,12/30/2025 00:00:00,6.85,ACE ENDICO,IT - 390 Fifth Ave
"Liqueur, Grappa Vendemmia Nonino",3,Liquor,false,true,each,12/30/2025 00:00:00,39.2,Seventh Ave House Vendor,IT - 530 Seventh Ave
"Baked Goods, Rustique Baguette",1,Baked Goods,false,true,each,12/30/2025 00:00:00,1.7,La Provence Miami - BILLPAY,IT - 1656 Collins Ave
"Rum, Cachaca Pitu",2,Liquor,false,false,liter,12/30/2025 00:00:00,27.95,Seventh Ave House Vendor,IT - 530 Seventh Ave
"Wine Rose, La Gioisa Prosecco Brut",1,Wine,false,false,each,12/30/2025 00:00:00,0.65,Seventh Ave House Vendor,IT - 530 Seventh Ave
"Dairy, Milk 4-1",1,Food - other,false,false,liter,12/31/2025 00:00:00,0.26,CGN Produce LLC ,IT - 1656 Collins Ave
"Dry Goods, Equal Sweetener Packets",1,Disposable,false,false,each,01/01/2026 00:00:00,0.02,I Halper Paper and Supplies Inc,IT - 390 Fifth Ave
"Disposable, Ice Cream Cup 4oz",1,Disposable,false,true,lb,01/01/2026 00:00:00,279.8,I Halper Paper and Supplies Inc,IT - 1014 Lincoln Rd
"Cleaning Supplies, SUPP Mop Handle",1,Disposable,false,true,each,01/01/2026 00:00:00,16.9,I Halper Paper and Supplies Inc,IT - 390 Fifth Ave
"Disposable, Hot Cup LOGO 16oz",1,Disposable,false,true,each,01/01/2026 00:00:00,0.01,I Halper Paper and Supplies Inc,IT - 390 Fifth Ave
"Disposable, Hot Cup LOGO 12oz",1,Disposable,false,true,each,01/01/2026 00:00:00,0.01,I Halper Paper and Supplies Inc,IT - 530 Seventh Ave
"Cleaning Supplies, SUPP 2/CT #37 Peroxide Disinfectant Cleaner",1,Disposable,false,false,each,01/01/2026 00:00:00,108.8,IMPERIAL DADE,IT - 1656 Collins Ave
"Disposable, Vacuum Bag",1,Disposable,false,false,each,01/01/2026 00:00:00,0.1,I Halper Paper and Supplies Inc,IT - 1014 Lincoln Rd
"Disposable, White Bags Small",1,Disposable,false,true,each,01/01/2026 00:00:00,0.01,I Halper Paper and Supplies Inc,IT - 1014 Lincoln Rd
"Cleaning Supplies, Sanitizer Ecologic Green",1,Disposable,false,false,liter,01/01/2026 00:00:00,3.51,I Halper Paper and Supplies Inc,IT - 1656 Collins Ave
"Disposable, Ice Cream Cup 8 Oz",1,Disposable,false,true,lb,01/01/2026 00:00:00,159.9,I Halper Paper and Supplies Inc,IT - 1014 Lincoln Rd
"Disposable, Bakery Bag 4lb",1,Disposable,false,false,lb,01/01/2026 00:00:00,16.49,I Halper Paper and Supplies Inc,IT - 1014 Lincoln Rd
"Disposable, Cold Cup LOGO 16oz",1,Disposable,false,true,each,01/01/2026 00:00:00,0.01,I Halper Paper and Supplies Inc,IT - 390 Fifth Ave
"Disposable, Take-Out Container 38oz",1,Disposable,false,false,each,01/01/2026 00:00:00,0.3,I Halper Paper and Supplies Inc,IT - 390 Fifth Ave
"NA Bev, Chinotto Sicilian Soda Polara",1,Soda,false,false,each,01/06/2026 00:00:00,0.89,VIANDER INC,IT - 1656 Collins Ave
"Protein, Seafood Smoked Salmon PRE-SLICED - WILD",1,Seafood,true,false,lb,01/06/2026 00:00:00,18.5,VIANDER INC,IT - 1656 Collins Ave
"Baked Goods, Scrocchiarella Classica",1,Baked Goods,false,true,each,01/08/2026 00:00:00,40.5,VIANDER INC,IT - 1014 Lincoln Rd
"Baked Goods, Focaccia Rolls Plain",1,Baked Goods,true,false,each,01/10/2026 00:00:00,0.45,La Provence Miami - BILLPAY,IT - 1656 Collins Ave
"Baked Goods, Cranberry Orange Muffin",1,Baked Goods,false,true,each,01/10/2026 00:00:00,1.5,La Provence Miami - BILLPAY,IT - 1656 Collins Ave
"Dry Goods, Tart Shell Chocolate",1,Dry Goods,false,false,each,01/11/2026 00:00:00,0.17,Paris Gourmet,IT - 390 Fifth Ave
"Dry Goods, Vanilla Paste",1,Dry Goods,true,false,lb,01/11/2026 00:00:00,6.67,Paris Gourmet,IT - 390 Fifth Ave
"Whiskey, Johnnie Walker Blue 80",1,Liquor,false,false,liter,01/12/2026 00:00:00,249.47,Southern Glazer,IT - 1656 Collins Ave
"Liqueur, BRAULIO LIQ AMARO",1,Liquor,false,true,each,01/12/2026 00:00:00,47.45,Southern Glazer,IT - 1656 Collins Ave
"Dry Goods, Domina Triangle Darto White",1,Dry Goods,false,false,each,01/16/2026 00:00:00,0.29,Casella Specialties Inc.,IT - 390 Fifth Ave
"Dry Goods, White Chocosmart",1,Dry Goods,false,false,each,01/16/2026 00:00:00,65.5,Casella Specialties Inc.,IT - 390 Fifth Ave
"Dry Goods, Dobla White Chocolate Shaving",1,Dry Goods,true,false,each,01/16/2026 00:00:00,55,Casella Specialties Inc.,IT - 390 Fifth Ave
"Dry Goods, Flour hi-glutenhi-protein",1,Food - other,false,false,lb,01/16/2026 00:00:00,0.56,ACE ENDICO,IT - 390 Fifth Ave
"Dry Goods, Dobla Curvy Elegance Dark",1,Dry Goods,false,false,each,01/16/2026 00:00:00,55,Casella Specialties Inc.,IT - 390 Fifth Ave
"Disposable, Cup Lid Alcas Coppa Deco",1,Disposable,false,false,each,01/16/2026 00:00:00,0.14,Casella Specialties Inc.,IT - 390 Fifth Ave
"Disposable, Cup Alcas Coppa Deco",1,Disposable,false,false,each,01/16/2026 00:00:00,0.34,Casella Specialties Inc.,IT - 390 Fifth Ave
"Produce, Blueberries fresh",1,Produce,false,true,liter,01/16/2026 00:00:00,5.36,Driscoll Foods,IT - 390 Fifth Ave
"Produce, Potatoes",1,Produce,false,true,lb,01/16/2026 00:00:00,0.06,Driscoll Foods,IT - 390 Fifth Ave
"Dry Goods, Mini Medero",1,Dry Goods,false,false,each,01/16/2026 00:00:00,0.19,Casella Specialties Inc.,IT - 390 Fifth Ave
"Protein, Pepperoni Sliced",1,Food - other,false,true,lb,01/16/2026 00:00:00,6.49,ACE ENDICO,IT - 390 Fifth Ave
"Dry Goods, Strawberry Topping",1,Food - other,true,true,liter,01/20/2026 00:00:00,10.66,ACE ENDICO,IT - 530 Seventh Ave
"Disposable, Plastic Lid for Yogurt Cup",1,Disposable,false,false,each,01/22/2026 00:00:00,0.04,SimplyPak,IT - 1014 Lincoln Rd
"Disposable, Tray Combo XS",1,Disposable,false,false,each,01/22/2026 00:00:00,0.12,SimplyPak,IT - 1014 Lincoln Rd
"Dry Goods, Sacco Rosso Red Flour",1,Food - other,false,false,lb,01/23/2026 00:00:00,1.1,ACE ENDICO,IT - 530 Seventh Ave
"NA Bev, Peach Daiquiri Mix",1,Liquor,false,true,each,01/23/2026 00:00:00,3.66,Southern Glazer,IT - 1656 Collins Ave
"Dry Goods, Nutmeg Whole",1,Dry Goods,true,false,each,01/24/2026 00:00:00,12.99,Driscoll Foods,IT - 530 Seventh Ave
"Frozen, Edamame",2,Frozen,false,false,lb,01/26/2026 00:00:00,3.98,"Superior Superfoods, LLC",IT - 1014 Lincoln Rd
"Dry Goods, Pistachio Pesto",2,Dry Goods,false,false,lb,01/26/2026 00:00:00,16.57,SOGNO TOSCANO,IT - 1014 Lincoln Rd
"NA Bev, Rishi Tat Blueberry Hibiscus",1,Coffee & Tea,false,false,each,01/26/2026 00:00:00,0.79,PRIME LINE DISTRIBUTORS,IT - 1656 Collins Ave
"Disposable,  Cold Cup 10oz",1,Disposable,false,false,each,01/27/2026 00:00:00,0.05,SimplyPak,IT - 1656 Collins Ave
"Baked Goods, Savoiardi Lady Finger Cookie",2,Food - other,false,true,lb,01/27/2026 00:00:00,5.75,ACE ENDICO,IT - 530 Seventh Ave
"NA Bev, Polara Mandarino Verde Sicilian Soda",2,Soda,false,true,each,01/27/2026 00:00:00,0.89,VIANDER INC,IT - 1656 Collins Ave
"Disposable, Paper 32oz Container Combo",2,Disposable,false,false,pack,01/27/2026 00:00:00,0.1,SimplyPak,IT - 1656 Collins Ave
"Disposable, Plastic 8oz Container Mono Portion",3,Disposable,false,false,each,01/27/2026 00:00:00,0.05,SimplyPak,IT - 1656 Collins Ave
"Protein, Seafood Battered Cod",1,Food - other,false,false,lb,01/30/2026 00:00:00,12.6,ACE ENDICO,IT - 390 Fifth Ave
"Wine, Red Mirafiore Nebbiolo Langhe 21",1,Liquor,true,false,liter,01/30/2026 00:00:00,23.87,Southern Glazer,IT - 1656 Collins Ave
"Dry Goods, Sugar Brown Dark",1,Food - other,false,false,lb,02/02/2026 00:00:00,1.95,ACE ENDICO,IT - 1014 Lincoln Rd
"Disposable, Plastic Lid For Small Cup 2oz",3,Disposable,false,false,each,02/03/2026 00:00:00,0.01,Simply Pak LLC,IT - 1656 Collins Ave
"Disposable, SUPP Carrier for Cups",3,Disposable,false,true,pack,02/03/2026 00:00:00,0.12,SimplyPak,IT - 1656 Collins Ave
"Dairy, Swiss",1,Food - other,false,true,lb,02/04/2026 00:00:00,6.12,ACE ENDICO,IT - 390 Fifth Ave
"Produce, Chives",1,Food - other,false,true,lb,02/04/2026 00:00:00,15.76,ACE ENDICO,IT - 390 Fifth Ave
"Dry Goods, Sprinkles Chocolate",1,Food - other,false,false,lb,02/04/2026 00:00:00,3.38,ACE ENDICO,IT - 390 Fifth Ave
"Produce, Apple Honey Crisp",1,Food - other,false,true,each,02/04/2026 00:00:00,0.11,ACE ENDICO,IT - 390 Fifth Ave
"Dry Goods, Whole Rosemary",1,Dry Goods,true,false,lb,02/05/2026 00:00:00,12.15,VIANDER INC,IT - 1014 Lincoln Rd
"Produce, Chickpeas",2,Food - other,true,true,lb,02/10/2026 00:00:00,0.58,ACE ENDICO,IT - 530 Seventh Ave
"NA Bev, Tea Lemon Indian Black",1,Food - other,false,false,lb,02/10/2026 00:00:00,2.77,ACE ENDICO,IT - 530 Seventh Ave
"Wine White, Bennati Pinot Grigio Fruili 23",1,Liquor,false,false,liter,02/12/2026 00:00:00,19.99,Southern Glazer,IT - 530 Seventh Ave
"Dry Goods, Whole Peeled Tomatoes",1,Dry Goods,true,true,lb,02/13/2026 00:00:00,0.86,SOGNO TOSCANO,IT - 390 Fifth Ave
"Dry Goods, White Truffle Oil",1,Dry Goods,false,false,liter,02/13/2026 00:00:00,102.08,SOGNO TOSCANO,IT - 390 Fifth Ave
"Dry Goods, Past Gnocchi GF Gluten Free",1,Dry Goods,false,false,lb,02/13/2026 00:00:00,3.63,SOGNO TOSCANO,IT - 390 Fifth Ave
"Dry Goods, Lasagna De Cecco Pasta",1,Food - other,false,true,lb,02/13/2026 00:00:00,3.81,ACE ENDICO,IT - 530 Seventh Ave
"Dry Goods, Whole Yellow Datterino Tomatos",2,Dairy,false,false,lb,02/13/2026 00:00:00,7.47,SOGNO TOSCANO,IT - 390 Fifth Ave
"Dairy, Romano Grated",2,Dairy,false,true,lb,02/13/2026 00:00:00,4,SOGNO TOSCANO,IT - 390 Fifth Ave
"Baked Goods, Ladyfinger Cookie",3,Food - other,false,true,lb,02/16/2026 00:00:00,6.94,ACE ENDICO,IT - 390 Fifth Ave
"Tequila, Don Julio Blanco",3,Liquor,true,true,each,02/17/2026 00:00:00,32,Fifth Ave House Vendor,IT - 390 Fifth Ave
"Gin, Gordon's London",1,Liquor,false,false,liter,02/17/2026 00:00:00,12,Fifth Ave House Vendor,IT - 390 Fifth Ave
"Produce, Blackberry",1,Food - other,false,true,liter,02/17/2026 00:00:00,3.43,ACE ENDICO,IT - 390 Fifth Ave
"Beer, Yungling Lager Bottles",1,Beer - Other,false,false,each,02/17/2026 00:00:00,1.08,Fifth Ave House Vendor,IT - 390 Fifth Ave
"Liqueur, Sambuca Ramazzotti",4,Liquor,false,false,liter,02/18/2026 00:00:00,248,Lincoln House Vendor,IT - 1014 Lincoln Rd
"Liqueur, Jagermeister",4,Liquor,false,false,liter,02/18/2026 00:00:00,351,Lincoln House Vendor,IT - 1014 Lincoln Rd
"Liqueur, Kahlua",5,Liquor,false,true,each,02/18/2026 00:00:00,385.92,Lincoln House Vendor,IT - 1014 Lincoln Rd
"Whiskey, Makers Mark",4,Liquor,false,false,liter,02/18/2026 00:00:00,414.4,Lincoln House Vendor,IT - 1014 Lincoln Rd
"Baked Goods, Bindi Belgian Waffle",2,Baked Goods,false,true,each,02/18/2026 00:00:00,1.35,Lincoln House Vendor,IT - 1014 Lincoln Rd
"Whiskey, Crown Royal",3,Liquor,false,false,liter,02/18/2026 00:00:00,35,Lincoln House Vendor,IT - 1014 Lincoln Rd
"Vodka, Skyy",4,Liquor,false,true,liter,02/18/2026 00:00:00,202.8,Lincoln House Vendor,IT - 1014 Lincoln Rd
"NA Bev, Bloody Mary Mix",4,NA Beverage - Other,false,false,liter,02/18/2026 00:00:00,8.74,Lincoln House Vendor,IT - 1014 Lincoln Rd
"Whiskey, Jim Beam",4,Liquor,false,false,liter,02/18/2026 00:00:00,112.29,Lincoln House Vendor,IT - 1014 Lincoln Rd
"Vodka, Belvedere",4,Liquor,false,false,liter,02/18/2026 00:00:00,243.6,Lincoln House Vendor,IT - 1014 Lincoln Rd
"Whiskey, J&B Scotch",4,Liquor,false,false,liter,02/18/2026 00:00:00,365.4,Lincoln House Vendor,IT - 1014 Lincoln Rd
"Gin, Malfy",4,Liquor,false,false,liter,02/18/2026 00:00:00,34.4,Lincoln House Vendor,IT - 1014 Lincoln Rd
"Liqueur, Martini & Rossi Fiero",3,Liquor,false,false,liter,02/18/2026 00:00:00,78,Lincoln House Vendor,IT - 1014 Lincoln Rd
"Rum, Cachaca Leblon",3,Liquor,false,false,liter,02/18/2026 00:00:00,27.95,Lincoln House Vendor,IT - 1014 Lincoln Rd
"Mezcal, Montelobos Tequila",3,Liquor,false,true,each,02/18/2026 00:00:00,229.5,Lincoln House Vendor,IT - 1014 Lincoln Rd
"Gin, Malfy Grapefruit",4,Liquor,false,false,liter,02/18/2026 00:00:00,34.4,Lincoln House Vendor,IT - 1014 Lincoln Rd
"Dairy, Tofu Firm",3,Meat/ Protein,false,true,lb,02/18/2026 00:00:00,19.46,Seventh Ave House Vendor,IT - 530 Seventh Ave
"Whiskey, Oban",4,Liquor,false,false,liter,02/18/2026 00:00:00,98.67,Lincoln House Vendor,IT - 1014 Lincoln Rd
"Produce, Orange Blossom",3,NA Beverage - Other,true,true,lb,02/18/2026 00:00:00,5,Lincoln House Vendor,IT - 1014 Lincoln Rd
"Liquor, Tequila Don Julio Anejo",4,Liquor,false,true,each,02/18/2026 00:00:00,319.5,Lincoln House Vendor,IT - 1014 Lincoln Rd
"Tequila, Mezcal Vida Del Maguey",4,Liquor,false,false,liter,02/18/2026 00:00:00,295.28,Lincoln House Vendor,IT - 1014 Lincoln Rd
"Gin, Monkey 47",4,Liquor,false,false,liter,02/18/2026 00:00:00,88.65,Lincoln House Vendor,IT - 1014 Lincoln Rd
"Liqueur, Italicus",4,Liquor,false,true,each,02/18/2026 00:00:00,38.24,Lincoln House Vendor,IT - 1014 Lincoln Rd
"Gin, Malfy Lemon (1 Liter)",4,Liquor,false,false,liter,02/18/2026 00:00:00,35,Lincoln House Vendor,IT - 1014 Lincoln Rd
"Liqueur, De Kuyper Elderflower",3,Liquor,false,false,liter,02/18/2026 00:00:00,108,Lincoln House Vendor,IT - 1014 Lincoln Rd
"Vodka, Beluga",4,Liquor,false,false,liter,02/18/2026 00:00:00,315.6,Lincoln House Vendor,IT - 1014 Lincoln Rd
"Liqueur, DeKuyper Curacao",5,Liquor,false,false,liter,02/18/2026 00:00:00,11.55,Lincoln House Vendor,IT - 1014 Lincoln Rd
"Liquor, Rum Barcelo Imperial 750ml",4,Liquor,false,false,liter,02/18/2026 00:00:00,208.8,Lincoln House Vendor,IT - 1014 Lincoln Rd
"Liqueur, St Germain Elderflower (1 Liter)",3,Liquor,false,true,liter,02/18/2026 00:00:00,294,Lincoln House Vendor,IT - 1014 Lincoln Rd
"NA Bev, Liquor Strawberry Mix Daquari",2,NA Beverage - Other,false,false,lb,02/18/2026 00:00:00,2.53,Lincoln House Vendor,IT - 1014 Lincoln Rd
"Whiskey, The Glenlivet",4,Liquor,false,false,liter,02/18/2026 00:00:00,760,Lincoln House Vendor,IT - 1014 Lincoln Rd
"Whiskey, Jameson",4,Liquor,false,false,liter,02/18/2026 00:00:00,523.92,Lincoln House Vendor,IT - 1014 Lincoln Rd
"Dry Goods, Chocosmart Dark",1,Dry Goods,true,false,lb,02/18/2026 00:00:00,5.4,Casella Specialties Inc.,IT - 390 Fifth Ave
"Whiskey, Chivas Regal",4,Liquor,false,false,liter,02/18/2026 00:00:00,46.77,Lincoln House Vendor,IT - 1014 Lincoln Rd
"Vodka, Titos",3,Liquor,false,false,liter,02/18/2026 00:00:00,340.56,Lincoln House Vendor,IT - 1014 Lincoln Rd
"Baked Goods, Hazelnut Chocolate Muffin",2,Dry Goods,false,true,each,02/18/2026 00:00:00,52.5,Lincoln House Vendor,IT - 1014 Lincoln Rd
"Vodka, Ketel One",4,Liquor,false,false,liter,02/18/2026 00:00:00,435,Lincoln House Vendor,IT - 1014 Lincoln Rd
"Rum, Barcelo Blanco",4,Liquor,false,false,liter,02/18/2026 00:00:00,132,Lincoln House Vendor,IT - 1014 Lincoln Rd
"Gin, Malfy Blood Orange",4,Liquor,false,false,liter,02/18/2026 00:00:00,34.4,Lincoln House Vendor,IT - 1014 Lincoln Rd
"Produce, Black Olives",4,Produce,true,true,lb,02/18/2026 00:00:00,2.87,Lincoln House Vendor,IT - 1014 Lincoln Rd
"NA Bev, Strawberry Daiquiri Mix",2,Liquor,false,true,each,02/18/2026 00:00:00,3.16,Collins House Vendor,IT - 1656 Collins Ave
"Liqueur, Grappa",2,Liquor,false,false,liter,02/18/2026 00:00:00,52.27,Lincoln House Vendor,IT - 1014 Lincoln Rd
"Dry Goods, Pesto Genovese with Basil",4,Dry Goods,false,true,lb,02/18/2026 00:00:00,6.24,Collins House Vendor,IT - 1656 Collins Ave
"Dry Goods, Caramel Filling Callebaut",1,Dry Goods,false,false,each,02/18/2026 00:00:00,21.35,Collins House Vendor,IT - 1656 Collins Ave
"Rum, Golden Zacapa (1 Liter)",4,Liquor,false,false,liter,02/18/2026 00:00:00,362.7,Lincoln House Vendor,IT - 1014 Lincoln Rd
"Dry Goods, Nostralina Toscana Pitted",1,Dry Goods,false,false,lb,02/18/2026 00:00:00,3.24,SOGNO TOSCANO,IT - 390 Fifth Ave
"Dry Goods, Caputo Rossa Flour",4,Dry Goods,false,true,lb,02/18/2026 00:00:00,0.99,Seventh Ave House Vendor,IT - 530 Seventh Ave
"Liqueur, Cynar Artichoke",4,Liquor,false,false,liter,02/18/2026 00:00:00,38.2,Lincoln House Vendor,IT - 1014 Lincoln Rd
"Tequila, Pueblo Viejo Blanco (1 Liter)",2,Liquor,false,false,liter,02/18/2026 00:00:00,370.5,Lincoln House Vendor,IT - 1014 Lincoln Rd
"Tequila, Arandas Blanco",4,Liquor,false,true,each,02/18/2026 00:00:00,129,Lincoln House Vendor,IT - 1014 Lincoln Rd
"Gin, Bombay",4,Liquor,true,false,liter,02/18/2026 00:00:00,30,Lincoln House Vendor,IT - 1014 Lincoln Rd
"Baked Goods, Brioche Bun 4.5""",2,Baked Goods,true,true,each,02/18/2026 00:00:00,0.75,Seventh Ave House Vendor,IT - 530 Seventh Ave
"Dry Goods, Coconut Milk",3,Dry Goods,true,true,lb,02/19/2026 00:00:00,3.72,VIANDER INC,IT - 1014 Lincoln Rd
"Dry Goods, Chick Peas in Brine",1,Dry Goods,false,false,lb,02/19/2026 00:00:00,1.22,VIANDER INC,IT - 1014 Lincoln Rd
"Disposables, SUPP Sleeve for Hot Cup",3,Disposable,false,true,each,02/20/2026 00:00:00,0.45,SimplyPak,IT - 1014 Lincoln Rd
"Dry Goods, Simple Syrup",1,Liquor,false,true,each,02/20/2026 00:00:00,0,Southern Glazer,IT - 1656 Collins Ave
"Liqueur, Martini & Rossi Rosso",5,Liquor,false,true,each,02/20/2026 00:00:00,11.25,Southern Glazer,IT - 1014 Lincoln Rd
"Tequila, Casamigos Reposado",1,Liquor,false,true,each,02/20/2026 00:00:00,70.7,Southern Glazer,IT - 1014 Lincoln Rd
"Gin, Gray Whale Gin 86",1,Liquor,false,true,each,02/20/2026 00:00:00,28.1,Southern Glazer,IT - 1014 Lincoln Rd
"Tequila, Clase Azul Reposado",1,Liquor,false,false,each,02/20/2026 00:00:00,137.1,Southern Glazer,IT - 1656 Collins Ave
"Gin, Roku",5,Liquor,false,false,liter,02/20/2026 00:00:00,37.45,Southern Glazer,IT - 1014 Lincoln Rd
"Baked Goods, Glaze Neutral",1,Baked Goods,false,true,lb,02/20/2026 00:00:00,0.87,Paris Gourmet,IT - 390 Fifth Ave
"Soda, San Pellegrino Limonata Can",1,Liquor,false,false,liter,02/20/2026 00:00:00,18.82,Southern Glazer,IT - 1656 Collins Ave
"Gin, Tanqueray",5,Liquor,true,true,each,02/20/2026 00:00:00,32.45,Southern Glazer,IT - 1656 Collins Ave
"Gin, Citadelle Gin B8",1,Liquor,false,true,each,02/20/2026 00:00:00,25.2,Southern Glazer,IT - 1014 Lincoln Rd
"Malibu, Rum Coconut",1,Liquor,false,false,liter,02/20/2026 00:00:00,23.78,Southern Glazer,IT - 1014 Lincoln Rd
"Protein, Bacon Layout 18-22",4,Meat/ Protein,true,true,lb,02/21/2026 00:00:00,4.18,"Superior Superfoods, LLC",IT - 1656 Collins Ave
"Produce, Cucumber",2,Produce,false,true,each,02/23/2026 00:00:00,1.3,Excellent Fruit & Produce,IT - 1014 Lincoln Rd
"Produce, Blackberries Pint",1,Produce,false,false,lb,02/23/2026 00:00:00,10.13,Excellent Fruit & Produce,IT - 1014 Lincoln Rd
"Produce, Cantaloupe",1,Produce,false,false,each,02/23/2026 00:00:00,5.95,Excellent Fruit & Produce,IT - 1014 Lincoln Rd
"Dairy, Quart Heavy Cream",1,Dairy,false,false,each,02/23/2026 00:00:00,59.74,"Superior Superfoods, LLC",IT - 1656 Collins Ave
"Produce, Green Seedless Grapes",1,Produce,false,false,lb,02/23/2026 00:00:00,3.45,Excellent Fruit & Produce,IT - 1014 Lincoln Rd
"Protein, Mortadella Pistachio",3,Produce,false,false,lb,02/23/2026 00:00:00,6.59,Excellent Fruit & Produce,IT - 1014 Lincoln Rd
